"","title","geo_accession","status","submission_date","last_update_date","type","channel_count","source_name_ch1","organism_ch1","characteristics_ch1","characteristics_ch1.1","molecule_ch1","extract_protocol_ch1","label_ch1","label_protocol_ch1","taxid_ch1","source_name_ch2","organism_ch2","characteristics_ch2","characteristics_ch2.1","molecule_ch2","extract_protocol_ch2","label_ch2","label_protocol_ch2","taxid_ch2","scan_protocol","description","data_processing","platform_id","contact_name","contact_email","contact_phone","contact_fax","contact_laboratory","contact_department","contact_institute","contact_address","contact_city","contact_state","contact_zip/postal_code","contact_country","contact_web_link","supplementary_file","data_row_count"
"GSM115759","Prostate_03-138A_GL3","GSM115759","Public on Jul 14 2006","Jun 21 2006","Oct 02 2008","RNA","2","Prostate_cancer_03-138A_LCM_GL3","Homo sapiens","Prostate Cancer patient 03-138A Gleason_Score:3+3 LCM_Gleason_Pattern:3 Gleason_Pattern:3 Age:60-69 PSA:4.3 Volume:0.5 Margin_Status:negative Treatment:prednisone","","total RNA","Following LCM, captured cells were lysed in RNA extraction buffer (Arcturus). RNA was isolated using the PicoPure RNA Isolation Kit (Arcturus) and the samples were DNAse treated using RNase-Free DNase (Qiagen). Each slide capture session lasted no longer than 20 minutes to minimize RNA degradation. The laser capture settings were: 55 mW beam, 1.5 ms pulse, 15 µm spot size. Subsequently, RNA was amplified through two rounds of linear amplification using the MessageAmp aRNA Kit (Ambion, Inc). Sample quality and quantification was assessed by agarose gel electrophoresis and absorbance at A260.","Cy5","The protocol used for indirect labeling of cDNAs was a modification of a protocol described elsewhere (http://cmgm.stanford.edu/pbrown/protocols/aadUTPCouplingProcedure.htm). In brief, cDNA probes were made from 2 µg of amplified RNA in a reaction volume of 30 µl containing 5 µg random hexamer primers, 0.2 mM 5-(3-aminoallyl)-2_-deoxyuridine-5_-triphosphate (amino acid-dUTP; Sigma-Aldrich), 0.3 mM dTTP, 0.5 mM each dATP, dCTP, and dGTP, and 380 units of Superscript II reverse transcriptase (Invitrogen) incubated at 42oC for 120 minutes. After RNA hydrolysis, purified cDNA was combined with either Cy3 or Cy5 monoreactive fluors (Amersham) that covalently couple to the cDNA-incorporated aminoallyl linker in the presence of 50 mM NaHCO3 (pH 9.0). Samples were randomly labeled with either Cy3 or Cy5 dye to account for dye-bias. The coupling reaction was quenched with hydroxylamine.","9606","Prostate_normal_adjacent_cancer_03-138A","Homo sapiens","Prostate normal adjacent from cancer patient 03-138A","","total RNA","Following LCM, captured cells were lysed in RNA extraction buffer (Arcturus). RNA was isolated using the PicoPure RNA Isolation Kit (Arcturus) and the samples were DNAse treated using RNase-Free DNase (Qiagen). Each slide capture session lasted no longer than 20 minutes to minimize RNA degradation. The laser capture settings were: 55 mW beam, 1.5 ms pulse, 15 µm spot size. Subsequently, RNA was amplified through two rounds of linear amplification using the MessageAmp aRNA Kit (Ambion, Inc). Sample quality and quantification was assessed by agarose gel electrophoresis and absorbance at A260.","Cy3","The protocol used for indirect labeling of cDNAs was a modification of a protocol described elsewhere (http://cmgm.stanford.edu/pbrown/protocols/aadUTPCouplingProcedure.htm). In brief, cDNA probes were made from 2 µg of amplified RNA in a reaction volume of 30 µl containing 5 µg random hexamer primers, 0.2 mM 5-(3-aminoallyl)-2_-deoxyuridine-5_-triphosphate (amino acid-dUTP; Sigma-Aldrich), 0.3 mM dTTP, 0.5 mM each dATP, dCTP, and dGTP, and 380 units of Superscript II reverse transcriptase (Invitrogen) incubated at 42oC for 120 minutes. After RNA hydrolysis, purified cDNA was combined with either Cy3 or Cy5 monoreactive fluors (Amersham) that covalently couple to the cDNA-incorporated aminoallyl linker in the presence of 50 mM NaHCO3 (pH 9.0). Samples were randomly labeled with either Cy3 or Cy5 dye to account for dye-bias. The coupling reaction was quenched with hydroxylamine.","9606","Fluorescent array images were collected for both Cy3 and Cy5 using a GenePix 4000B fluorescent scanner (Axon Instruments, Foster City, CA).  The image intensity data were gridded and extracted using GenePix Pro 4.1 software.","Human prostate cancer patient 03-138A with Gleason Score 3+3 prostate cancer hybridized against normal adjacent prostate tissue from the same patient through laser capture microdissection (LCM).","Log-Ratios: For each spot and in each channel (Cy3 and Cy5); the median background intensity was subtracted from the median foreground intensity. Log-ratios of cancer expression to benign expression were created by first dividing the background subtracted intensities (CaP/Benign) and then taking the log base 2. If the median background intensity was greater than the median foreground intensity, the spot was considered missing. Removal of Control Genes: The array contained approximately 400 clones used only for quality control purposes (i.e. yeast sequences or blank spots). These clones were removed from the dataset. Lowess Normalization: For each array, the log-ratio data were centered using a print-tip specific Lowess curve (Y. H. Yang, S. Dudoit, P. Luu and T. P. Speed. Normalization for cDNA Microarray Data. SPIE BiOS 2001, San Jose, California, January 2001). This curve was fit to the log intensity versus log-ratio plot using the neighboring 20.0% of the data to calculate the fit at each spot. The Lowess fit at each point was subtracted from the observed log-ratio for that spot, resulting in a normalized log-ratio. Assessing Spot Quality: Spots of poor quality, as determined by both visual inspection and GenePix Pro 4.1 quality flags were considered missing. In addition, spots with background subtracted intensity levels less than 300 were considered missing due to poorly hybridized cDNAs. Clones which were missing on > 20% of arrays were removed from the analysis. Imputation: Missing values were imputed using k-nearest neighbors imputation (k = 10) (2). The dataset was split by Gleason pattern (Grades 3, 4 and 5) and imputation was performed separately for each pattern. Average Replicated Clones: Log-ratios from the replicated cDNA spots on each PEDB chip were averaged after normalization and imputation. These average expression values were used for comparative analysis.","GPL3834","Denise,,Mauldin","dmauldin@fhcrc.org","2066673480","2066672917","Peter Nelson","Human Biology","Fred Hutchinson Cancer Research Center","1100 Fairview Ave N D4-100","Seattle","WA","98109","USA","http://www.pedb.org","ftp://ftp.ncbi.nlm.nih.gov/pub/geo/DATA/supplementary/samples/GSM115nnn/GSM115759/GSM115759.gpr.gz","15488"
"GSM115760","Prostate_03-135C_GL4","GSM115760","Public on Jul 14 2006","Jun 21 2006","Oct 02 2008","RNA","2","Prostate_cancer_03-135C_LCM_GL4","Homo sapiens","Prostate Cancer patient 03-135C Gleason_Score:4+3 LCM_Gleason_Pattern:4 Gleason_Pattern:4 Age:50-59 PSA:5.0 Volume:2.3 Margin_Status:negative Treatment:none","","total RNA","Following LCM, captured cells were lysed in RNA extraction buffer (Arcturus). RNA was isolated using the PicoPure RNA Isolation Kit (Arcturus) and the samples were DNAse treated using RNase-Free DNase (Qiagen). Each slide capture session lasted no longer than 20 minutes to minimize RNA degradation. The laser capture settings were: 55 mW beam, 1.5 ms pulse, 15 µm spot size. Subsequently, RNA was amplified through two rounds of linear amplification using the MessageAmp aRNA Kit (Ambion, Inc). Sample quality and quantification was assessed by agarose gel electrophoresis and absorbance at A260.","Cy5","The protocol used for indirect labeling of cDNAs was a modification of a protocol described elsewhere (http://cmgm.stanford.edu/pbrown/protocols/aadUTPCouplingProcedure.htm). In brief, cDNA probes were made from 2 µg of amplified RNA in a reaction volume of 30 µl containing 5 µg random hexamer primers, 0.2 mM 5-(3-aminoallyl)-2_-deoxyuridine-5_-triphosphate (amino acid-dUTP; Sigma-Aldrich), 0.3 mM dTTP, 0.5 mM each dATP, dCTP, and dGTP, and 380 units of Superscript II reverse transcriptase (Invitrogen) incubated at 42oC for 120 minutes. After RNA hydrolysis, purified cDNA was combined with either Cy3 or Cy5 monoreactive fluors (Amersham) that covalently couple to the cDNA-incorporated aminoallyl linker in the presence of 50 mM NaHCO3 (pH 9.0). Samples were randomly labeled with either Cy3 or Cy5 dye to account for dye-bias. The coupling reaction was quenched with hydroxylamine.","9606","Prostate_normal_adjacent_cancer_03-135C","Homo sapiens","Prostate normal adjacent from cancer patient 03-135C","","total RNA","Following LCM, captured cells were lysed in RNA extraction buffer (Arcturus). RNA was isolated using the PicoPure RNA Isolation Kit (Arcturus) and the samples were DNAse treated using RNase-Free DNase (Qiagen). Each slide capture session lasted no longer than 20 minutes to minimize RNA degradation. The laser capture settings were: 55 mW beam, 1.5 ms pulse, 15 µm spot size. Subsequently, RNA was amplified through two rounds of linear amplification using the MessageAmp aRNA Kit (Ambion, Inc). Sample quality and quantification was assessed by agarose gel electrophoresis and absorbance at A260.","Cy3","The protocol used for indirect labeling of cDNAs was a modification of a protocol described elsewhere (http://cmgm.stanford.edu/pbrown/protocols/aadUTPCouplingProcedure.htm). In brief, cDNA probes were made from 2 µg of amplified RNA in a reaction volume of 30 µl containing 5 µg random hexamer primers, 0.2 mM 5-(3-aminoallyl)-2_-deoxyuridine-5_-triphosphate (amino acid-dUTP; Sigma-Aldrich), 0.3 mM dTTP, 0.5 mM each dATP, dCTP, and dGTP, and 380 units of Superscript II reverse transcriptase (Invitrogen) incubated at 42oC for 120 minutes. After RNA hydrolysis, purified cDNA was combined with either Cy3 or Cy5 monoreactive fluors (Amersham) that covalently couple to the cDNA-incorporated aminoallyl linker in the presence of 50 mM NaHCO3 (pH 9.0). Samples were randomly labeled with either Cy3 or Cy5 dye to account for dye-bias. The coupling reaction was quenched with hydroxylamine.","9606","Fluorescent array images were collected for both Cy3 and Cy5 using a GenePix 4000B fluorescent scanner (Axon Instruments, Foster City, CA).  The image intensity data were gridded and extracted using GenePix Pro 4.1 software.","Human prostate cancer patient 03-135C with Gleason Score 4+3 prostate cancer hybridized against normal adjacent prostate tissue from the same patient through laser capture microdissection (LCM).","Log-Ratios: For each spot and in each channel (Cy3 and Cy5); the median background intensity was subtracted from the median foreground intensity. Log-ratios of cancer expression to benign expression were created by first dividing the background subtracted intensities (CaP/Benign) and then taking the log base 2. If the median background intensity was greater than the median foreground intensity, the spot was considered missing. Removal of Control Genes: The array contained approximately 400 clones used only for quality control purposes (i.e. yeast sequences or blank spots). These clones were removed from the dataset. Lowess Normalization: For each array, the log-ratio data were centered using a print-tip specific Lowess curve (Y. H. Yang, S. Dudoit, P. Luu and T. P. Speed. Normalization for cDNA Microarray Data. SPIE BiOS 2001, San Jose, California, January 2001). This curve was fit to the log intensity versus log-ratio plot using the neighboring 20.0% of the data to calculate the fit at each spot. The Lowess fit at each point was subtracted from the observed log-ratio for that spot, resulting in a normalized log-ratio. Assessing Spot Quality: Spots of poor quality, as determined by both visual inspection and GenePix Pro 4.1 quality flags were considered missing. In addition, spots with background subtracted intensity levels less than 300 were considered missing due to poorly hybridized cDNAs. Clones which were missing on > 20% of arrays were removed from the analysis. Imputation: Missing values were imputed using k-nearest neighbors imputation (k = 10) (2). The dataset was split by Gleason pattern (Grades 3, 4 and 5) and imputation was performed separately for each pattern. Average Replicated Clones: Log-ratios from the replicated cDNA spots on each PEDB chip were averaged after normalization and imputation. These average expression values were used for comparative analysis.","GPL3834","Denise,,Mauldin","dmauldin@fhcrc.org","2066673480","2066672917","Peter Nelson","Human Biology","Fred Hutchinson Cancer Research Center","1100 Fairview Ave N D4-100","Seattle","WA","98109","USA","http://www.pedb.org","ftp://ftp.ncbi.nlm.nih.gov/pub/geo/DATA/supplementary/samples/GSM115nnn/GSM115760/GSM115760.gpr.gz","15488"
"GSM115761","Prostate_03-158F_GL4","GSM115761","Public on Jul 14 2006","Jun 21 2006","Oct 02 2008","RNA","2","Prostate_normal_adjacent_cancer_03-158F","Homo sapiens","Prostate normal adjacent from cancer patient 03-158F","","total RNA","Following LCM, captured cells were lysed in RNA extraction buffer (Arcturus). RNA was isolated using the PicoPure RNA Isolation Kit (Arcturus) and the samples were DNAse treated using RNase-Free DNase (Qiagen). Each slide capture session lasted no longer than 20 minutes to minimize RNA degradation. The laser capture settings were: 55 mW beam, 1.5 ms pulse, 15 µm spot size. Subsequently, RNA was amplified through two rounds of linear amplification using the MessageAmp aRNA Kit (Ambion, Inc). Sample quality and quantification was assessed by agarose gel electrophoresis and absorbance at A260.","Cy5","The protocol used for indirect labeling of cDNAs was a modification of a protocol described elsewhere (http://cmgm.stanford.edu/pbrown/protocols/aadUTPCouplingProcedure.htm). In brief, cDNA probes were made from 2 µg of amplified RNA in a reaction volume of 30 µl containing 5 µg random hexamer primers, 0.2 mM 5-(3-aminoallyl)-2_-deoxyuridine-5_-triphosphate (amino acid-dUTP; Sigma-Aldrich), 0.3 mM dTTP, 0.5 mM each dATP, dCTP, and dGTP, and 380 units of Superscript II reverse transcriptase (Invitrogen) incubated at 42oC for 120 minutes. After RNA hydrolysis, purified cDNA was combined with either Cy3 or Cy5 monoreactive fluors (Amersham) that covalently couple to the cDNA-incorporated aminoallyl linker in the presence of 50 mM NaHCO3 (pH 9.0). Samples were randomly labeled with either Cy3 or Cy5 dye to account for dye-bias. The coupling reaction was quenched with hydroxylamine.","9606","Prostate_cancer_03-158F_LCM_GL4","Homo sapiens","Prostate Cancer patient 03-158F Gleason_Score:4+3 LCM_Gleason_Pattern:4 Gleason_Pattern:4 Age:70-79 PSA:4.2 Volume:3.5 Margin_Status:negative Treatment:none","","total RNA","Following LCM, captured cells were lysed in RNA extraction buffer (Arcturus). RNA was isolated using the PicoPure RNA Isolation Kit (Arcturus) and the samples were DNAse treated using RNase-Free DNase (Qiagen). Each slide capture session lasted no longer than 20 minutes to minimize RNA degradation. The laser capture settings were: 55 mW beam, 1.5 ms pulse, 15 µm spot size. Subsequently, RNA was amplified through two rounds of linear amplification using the MessageAmp aRNA Kit (Ambion, Inc). Sample quality and quantification was assessed by agarose gel electrophoresis and absorbance at A260.","Cy3","The protocol used for indirect labeling of cDNAs was a modification of a protocol described elsewhere (http://cmgm.stanford.edu/pbrown/protocols/aadUTPCouplingProcedure.htm). In brief, cDNA probes were made from 2 µg of amplified RNA in a reaction volume of 30 µl containing 5 µg random hexamer primers, 0.2 mM 5-(3-aminoallyl)-2_-deoxyuridine-5_-triphosphate (amino acid-dUTP; Sigma-Aldrich), 0.3 mM dTTP, 0.5 mM each dATP, dCTP, and dGTP, and 380 units of Superscript II reverse transcriptase (Invitrogen) incubated at 42oC for 120 minutes. After RNA hydrolysis, purified cDNA was combined with either Cy3 or Cy5 monoreactive fluors (Amersham) that covalently couple to the cDNA-incorporated aminoallyl linker in the presence of 50 mM NaHCO3 (pH 9.0). Samples were randomly labeled with either Cy3 or Cy5 dye to account for dye-bias. The coupling reaction was quenched with hydroxylamine.","9606","Fluorescent array images were collected for both Cy3 and Cy5 using a GenePix 4000B fluorescent scanner (Axon Instruments, Foster City, CA).  The image intensity data were gridded and extracted using GenePix Pro 4.1 software.","Human prostate cancer patient 03-158F with Gleason Score 4+3 prostate cancer hybridized against normal adjacent prostate tissue from the same patient through laser capture microdissection (LCM).","Log-Ratios: For each spot and in each channel (Cy3 and Cy5); the median background intensity was subtracted from the median foreground intensity. Log-ratios of cancer expression to benign expression were created by first dividing the background subtracted intensities (CaP/Benign) and then taking the log base 2. If the median background intensity was greater than the median foreground intensity, the spot was considered missing. Removal of Control Genes: The array contained approximately 400 clones used only for quality control purposes (i.e. yeast sequences or blank spots). These clones were removed from the dataset. Lowess Normalization: For each array, the log-ratio data were centered using a print-tip specific Lowess curve (Y. H. Yang, S. Dudoit, P. Luu and T. P. Speed. Normalization for cDNA Microarray Data. SPIE BiOS 2001, San Jose, California, January 2001). This curve was fit to the log intensity versus log-ratio plot using the neighboring 20.0% of the data to calculate the fit at each spot. The Lowess fit at each point was subtracted from the observed log-ratio for that spot, resulting in a normalized log-ratio. Assessing Spot Quality: Spots of poor quality, as determined by both visual inspection and GenePix Pro 4.1 quality flags were considered missing. In addition, spots with background subtracted intensity levels less than 300 were considered missing due to poorly hybridized cDNAs. Clones which were missing on > 20% of arrays were removed from the analysis. Imputation: Missing values were imputed using k-nearest neighbors imputation (k = 10) (2). The dataset was split by Gleason pattern (Grades 3, 4 and 5) and imputation was performed separately for each pattern. Average Replicated Clones: Log-ratios from the replicated cDNA spots on each PEDB chip were averaged after normalization and imputation. These average expression values were used for comparative analysis.","GPL3834","Denise,,Mauldin","dmauldin@fhcrc.org","2066673480","2066672917","Peter Nelson","Human Biology","Fred Hutchinson Cancer Research Center","1100 Fairview Ave N D4-100","Seattle","WA","98109","USA","http://www.pedb.org","ftp://ftp.ncbi.nlm.nih.gov/pub/geo/DATA/supplementary/samples/GSM115nnn/GSM115761/GSM115761.gpr.gz","15488"
"GSM115762","Prostate_03-155C_GL4","GSM115762","Public on Jul 14 2006","Jun 21 2006","Oct 02 2008","RNA","2","Prostate_normal_adjacent_cancer_03-155C","Homo sapiens","Prostate normal adjacent from cancer patient 03-155C","","total RNA","Following LCM, captured cells were lysed in RNA extraction buffer (Arcturus). RNA was isolated using the PicoPure RNA Isolation Kit (Arcturus) and the samples were DNAse treated using RNase-Free DNase (Qiagen). Each slide capture session lasted no longer than 20 minutes to minimize RNA degradation. The laser capture settings were: 55 mW beam, 1.5 ms pulse, 15 µm spot size. Subsequently, RNA was amplified through two rounds of linear amplification using the MessageAmp aRNA Kit (Ambion, Inc). Sample quality and quantification was assessed by agarose gel electrophoresis and absorbance at A260.","Cy5","The protocol used for indirect labeling of cDNAs was a modification of a protocol described elsewhere (http://cmgm.stanford.edu/pbrown/protocols/aadUTPCouplingProcedure.htm). In brief, cDNA probes were made from 2 µg of amplified RNA in a reaction volume of 30 µl containing 5 µg random hexamer primers, 0.2 mM 5-(3-aminoallyl)-2_-deoxyuridine-5_-triphosphate (amino acid-dUTP; Sigma-Aldrich), 0.3 mM dTTP, 0.5 mM each dATP, dCTP, and dGTP, and 380 units of Superscript II reverse transcriptase (Invitrogen) incubated at 42oC for 120 minutes. After RNA hydrolysis, purified cDNA was combined with either Cy3 or Cy5 monoreactive fluors (Amersham) that covalently couple to the cDNA-incorporated aminoallyl linker in the presence of 50 mM NaHCO3 (pH 9.0). Samples were randomly labeled with either Cy3 or Cy5 dye to account for dye-bias. The coupling reaction was quenched with hydroxylamine.","9606","Prostate_cancer_03-155C_LCM_GL4","Homo sapiens","Prostate Cancer patient 03-155C Gleason_Score:4+4 (tertiary pattern 3)"," LCM_Gleason_Pattern:4 Gleason_Pattern:4 Age:60-69 PSA:6.2 Volume:4.5 Margin_Status:negative Treatment:low-fat diet (study patient)","total RNA","Following LCM, captured cells were lysed in RNA extraction buffer (Arcturus). RNA was isolated using the PicoPure RNA Isolation Kit (Arcturus) and the samples were DNAse treated using RNase-Free DNase (Qiagen). Each slide capture session lasted no longer than 20 minutes to minimize RNA degradation. The laser capture settings were: 55 mW beam, 1.5 ms pulse, 15 µm spot size. Subsequently, RNA was amplified through two rounds of linear amplification using the MessageAmp aRNA Kit (Ambion, Inc). Sample quality and quantification was assessed by agarose gel electrophoresis and absorbance at A260.","Cy3","The protocol used for indirect labeling of cDNAs was a modification of a protocol described elsewhere (http://cmgm.stanford.edu/pbrown/protocols/aadUTPCouplingProcedure.htm). In brief, cDNA probes were made from 2 µg of amplified RNA in a reaction volume of 30 µl containing 5 µg random hexamer primers, 0.2 mM 5-(3-aminoallyl)-2_-deoxyuridine-5_-triphosphate (amino acid-dUTP; Sigma-Aldrich), 0.3 mM dTTP, 0.5 mM each dATP, dCTP, and dGTP, and 380 units of Superscript II reverse transcriptase (Invitrogen) incubated at 42oC for 120 minutes. After RNA hydrolysis, purified cDNA was combined with either Cy3 or Cy5 monoreactive fluors (Amersham) that covalently couple to the cDNA-incorporated aminoallyl linker in the presence of 50 mM NaHCO3 (pH 9.0). Samples were randomly labeled with either Cy3 or Cy5 dye to account for dye-bias. The coupling reaction was quenched with hydroxylamine.","9606","Fluorescent array images were collected for both Cy3 and Cy5 using a GenePix 4000B fluorescent scanner (Axon Instruments, Foster City, CA).  The image intensity data were gridded and extracted using GenePix Pro 4.1 software.","Human prostate cancer patient 03-155C with Gleason Score 4+4 (tertiary pattern 3) prostate cancer hybridized against normal adjacent prostate tissue from the same patient through laser capture microdissection (LCM).","Log-Ratios: For each spot and in each channel (Cy3 and Cy5); the median background intensity was subtracted from the median foreground intensity. Log-ratios of cancer expression to benign expression were created by first dividing the background subtracted intensities (CaP/Benign) and then taking the log base 2. If the median background intensity was greater than the median foreground intensity, the spot was considered missing. Removal of Control Genes: The array contained approximately 400 clones used only for quality control purposes (i.e. yeast sequences or blank spots). These clones were removed from the dataset. Lowess Normalization: For each array, the log-ratio data were centered using a print-tip specific Lowess curve (Y. H. Yang, S. Dudoit, P. Luu and T. P. Speed. Normalization for cDNA Microarray Data. SPIE BiOS 2001, San Jose, California, January 2001). This curve was fit to the log intensity versus log-ratio plot using the neighboring 20.0% of the data to calculate the fit at each spot. The Lowess fit at each point was subtracted from the observed log-ratio for that spot, resulting in a normalized log-ratio. Assessing Spot Quality: Spots of poor quality, as determined by both visual inspection and GenePix Pro 4.1 quality flags were considered missing. In addition, spots with background subtracted intensity levels less than 300 were considered missing due to poorly hybridized cDNAs. Clones which were missing on > 20% of arrays were removed from the analysis. Imputation: Missing values were imputed using k-nearest neighbors imputation (k = 10) (2). The dataset was split by Gleason pattern (Grades 3, 4 and 5) and imputation was performed separately for each pattern. Average Replicated Clones: Log-ratios from the replicated cDNA spots on each PEDB chip were averaged after normalization and imputation. These average expression values were used for comparative analysis.","GPL3834","Denise,,Mauldin","dmauldin@fhcrc.org","2066673480","2066672917","Peter Nelson","Human Biology","Fred Hutchinson Cancer Research Center","1100 Fairview Ave N D4-100","Seattle","WA","98109","USA","http://www.pedb.org","ftp://ftp.ncbi.nlm.nih.gov/pub/geo/DATA/supplementary/samples/GSM115nnn/GSM115762/GSM115762.gpr.gz","15488"
